NAME,B19013_001E,metropolitan statistical area/micropolitan statistical area,year
"Aberdeen, WA Micro Area",40019,10140,2010
"Abilene, TX Metro Area",40630,10180,2010
"Adrian, MI Micro Area",45563,10300,2010
"Aguadilla-Isabela-San Sebasti?n, PR Metro Area",14313,10380,2010
"Akron, OH Metro Area",46521,10420,2010
"Albany, GA Metro Area",34002,10500,2010
"Albany-Lebanon, OR Micro Area",42900,10540,2010
"Albany-Schenectady-Troy, NY Metro Area",55796,10580,2010
"Albertville, AL Micro Area",39343,10700,2010
"Albuquerque, NM Metro Area",47383,10740,2010
"Alexandria, LA Metro Area",40017,10780,2010
"Allegan, MI Micro Area",44847,10880,2010
"Allentown-Bethlehem-Easton, PA-NJ Metro Area",55630,10900,2010
"Altoona, PA Metro Area",42990,11020,2010
"Amarillo, TX Metro Area",46390,11100,2010
"Ames, IA Metro Area",48034,11180,2010
"Anchorage, AK Metro Area",71490,11260,2010
"Anderson, IN Metro Area",38772,11300,2010
"Anderson, SC Metro Area",36770,11340,2010
"Ann Arbor, MI Metro Area",55880,11460,2010
"Anniston-Oxford, AL Metro Area",36675,11500,2010
"Appleton, WI Metro Area",55883,11540,2010
"Asheville, NC Metro Area",42168,11700,2010
"Ashtabula, OH Micro Area",38751,11780,2010
"Athens, TX Micro Area",36570,11980,2010
"Athens-Clarke County, GA Metro Area",40391,12020,2010
"Atlanta-Sandy Springs-Marietta, GA Metro Area",53182,12060,2010
"Atlantic City-Hammonton, NJ Metro Area",52571,12100,2010
"Auburn, NY Micro Area",49136,12180,2010
"Auburn-Opelika, AL Metro Area",39381,12220,2010
"Augusta-Richmond County, GA-SC Metro Area",44477,12260,2010
"Augusta-Waterville, ME Micro Area",44964,12300,2010
"Austin-Round Rock-San Marcos, TX Metro Area",55744,12420,2010
"Bakersfield-Delano, CA Metro Area",45524,12540,2010
"Baltimore-Towson, MD Metro Area",64812,12580,2010
"Bangor, ME Metro Area",42964,12620,2010
"Barnstable Town, MA Metro Area",55294,12700,2010
"Baton Rouge, LA Metro Area",48294,12940,2010
"Battle Creek, MI Metro Area",42921,12980,2010
"Bay City, MI Metro Area",45451,13020,2010
"Beaumont-Port Arthur, TX Metro Area",41291,13140,2010
"Beaver Dam, WI Micro Area",50797,13180,2010
"Beckley, WV Micro Area",37982,13220,2010
"Bellingham, WA Metro Area",49938,13380,2010
"Bend, OR Metro Area",44680,13460,2010
"Billings, MT Metro Area",47968,13740,2010
"Binghamton, NY Metro Area",45959,13780,2010
"Birmingham-Hoover, AL Metro Area",44216,13820,2010
"Bismarck, ND Metro Area",53403,13900,2010
"Blacksburg-Christiansburg-Radford, VA Metro Area",40127,13980,2010
"Bloomington, IN Metro Area",38143,14020,2010
"Bloomington-Normal, IL Metro Area",59588,14060,2010
"Bloomsburg-Berwick, PA Micro Area",42729,14100,2010
"Bluefield, WV-VA Micro Area",31841,14140,2010
"Boise City-Nampa, ID Metro Area",47237,14260,2010
"Boston-Cambridge-Quincy, MA-NH Metro Area",68020,14460,2010
"Boulder, CO Metro Area",61859,14500,2010
"Bowling Green, KY Metro Area",39092,14540,2010
"Bozeman, MT Micro Area",49506,14580,2010
"Brainerd, MN Micro Area",44028,14660,2010
"Branson, MO Micro Area",35897,14700,2010
"Bremerton-Silverdale, WA Metro Area",56303,14740,2010
"Bridgeport-Stamford-Norwalk, CT Metro Area",74831,14860,2010
"Brownsville-Harlingen, TX Metro Area",31736,15180,2010
"Brunswick, GA Metro Area",39066,15260,2010
"Buffalo-Niagara Falls, NY Metro Area",46420,15380,2010
"Burlington, NC Metro Area",41058,15500,2010
"Burlington-South Burlington, VT Metro Area",54738,15540,2010
"Canton-Massillon, OH Metro Area",42365,15940,2010
"Cape Coral-Fort Myers, FL Metro Area",43936,15980,2010
"Cape Girardeau-Jackson, MO-IL Metro Area",41288,16020,2010
"Carson City, NV Metro Area",52414,16180,2010
"Casper, WY Metro Area",51735,16220,2010
"Cedar Rapids, IA Metro Area",53755,16300,2010
"Centralia, WA Micro Area",38643,16500,2010
"Chambersburg, PA Micro Area",49514,16540,2010
"Champaign-Urbana, IL Metro Area",45845,16580,2010
"Charleston, WV Metro Area",43922,16620,2010
"Charleston-North Charleston-Summerville, SC Metro Area",48062,16700,2010
"Charlotte-Gastonia-Rock Hill, NC-SC Metro Area",50449,16740,2010
"Charlottesville, VA Metro Area",56808,16820,2010
"Chattanooga, TN-GA Metro Area",42288,16860,2010
"Cheyenne, WY Metro Area",48784,16940,2010
"Chicago-Joliet-Naperville, IL-IN-WI Metro Area",57104,16980,2010
"Chico, CA Metro Area",41657,17020,2010
"Chillicothe, OH Micro Area",40811,17060,2010
"Cincinnati-Middletown, OH-KY-IN Metro Area",51572,17140,2010
"Clarksburg, WV Micro Area",38866,17220,2010
"Clarksville, TN-KY Metro Area",42262,17300,2010
"Clearlake, CA Micro Area",34910,17340,2010
"Cleveland, TN Metro Area",37193,17420,2010
"Cleveland-Elyria-Mentor, OH Metro Area",46231,17460,2010
"Coamo, PR Micro Area",15902,17620,2010
"Coeur d'Alene, ID Metro Area",42316,17660,2010
"College Station-Bryan, TX Metro Area",35961,17780,2010
"Colorado Springs, CO Metro Area",51683,17820,2010
"Columbia, MO Metro Area",40853,17860,2010
"Columbia, SC Metro Area",45929,17900,2010
"Columbia, TN Micro Area",45435,17940,2010
"Columbus, GA-AL Metro Area",36553,17980,2010
"Columbus, IN Metro Area",47192,18020,2010
"Columbus, OH Metro Area",51039,18140,2010
"Concord, NH Micro Area",61310,18180,2010
"Cookeville, TN Micro Area",34208,18260,2010
"Coos Bay, OR Micro Area",35955,18300,2010
"Corning, NY Micro Area",45995,18500,2010
"Corpus Christi, TX Metro Area",41994,18580,2010
"Corvallis, OR Metro Area",45913,18700,2010
"Crestview-Fort Walton Beach-Destin, FL Metro Area",51529,18880,2010
"Cullman, AL Micro Area",35786,18980,2010
"Cumberland, MD-WV Metro Area",34847,19060,2010
"Dallas-Fort Worth-Arlington, TX Metro Area",54449,19100,2010
"Dalton, GA Metro Area",39476,19140,2010
"Danville, IL Metro Area",38167,19180,2010
"Danville, VA Metro Area",35964,19260,2010
"Daphne-Fairhope-Foley, AL Micro Area",47502,19300,2010
"Davenport-Moline-Rock Island, IA-IL Metro Area",46310,19340,2010
"Dayton, OH Metro Area",43832,19380,2010
"Decatur, AL Metro Area",42172,19460,2010
"Decatur, IL Metro Area",40919,19500,2010
"Deltona-Daytona Beach-Ormond Beach, FL Metro Area",41556,19660,2010
"Denver-Aurora-Broomfield, CO Metro Area",58732,19740,2010
"Des Moines-West Des Moines, IA Metro Area",54685,19780,2010
"Detroit-Warren-Livonia, MI Metro Area",48198,19820,2010
"Dothan, AL Metro Area",38638,20020,2010
"Dover, DE Metro Area",54617,20100,2010
"DuBois, PA Micro Area",36331,20180,2010
"Dubuque, IA Metro Area",49776,20220,2010
"Duluth, MN-WI Metro Area",42083,20260,2010
"Dunn, NC Micro Area",39584,20380,2010
"Durham-Chapel Hill, NC Metro Area",47982,20500,2010
"East Liverpool-Salem, OH Micro Area",35909,20620,2010
"East Stroudsburg, PA Micro Area",54549,20700,2010
"Eau Claire, WI Metro Area",44086,20740,2010
"El Centro, CA Metro Area",41802,20940,2010
"Elizabethtown, KY Metro Area",42363,21060,2010
"Elkhart-Goshen, IN Metro Area",41748,21140,2010
"Elmira, NY Metro Area",47643,21300,2010
"El Paso, TX Metro Area",36015,21340,2010
"Enterprise-Ozark, AL Micro Area",40886,21460,2010
"Erie, PA Metro Area",42519,21500,2010
"Eugene-Springfield, OR Metro Area",40276,21660,2010
"Eureka-Arcata-Fortuna, CA Micro Area",38492,21700,2010
"Evansville, IN-KY Metro Area",44319,21780,2010
"Fairbanks, AK Metro Area",60785,21820,2010
"Fajardo, PR Metro Area",18966,21940,2010
"Fargo, ND-MN Metro Area",50088,22020,2010
"Farmington, MO Micro Area",33428,22100,2010
"Farmington, NM Metro Area",45127,22140,2010
"Fayetteville, NC Metro Area",43458,22180,2010
"Fayetteville-Springdale-Rogers, AR-MO Metro Area",45101,22220,2010
"Findlay, OH Micro Area",50150,22300,2010
"Flagstaff, AZ Metro Area",42130,22380,2010
"Flint, MI Metro Area",38819,22420,2010
"Florence, SC Metro Area",37590,22500,2010
"Florence-Muscle Shoals, AL Metro Area",37638,22520,2010
"Fond du Lac, WI Metro Area",49718,22540,2010
"Forest City, NC Micro Area",35442,22580,2010
"Fort Collins-Loveland, CO Metro Area",54154,22660,2010
"Fort Payne, AL Micro Area",35967,22840,2010
"Fort Smith, AR-OK Metro Area",37992,22900,2010
"Fort Wayne, IN Metro Area",47004,23060,2010
"Frankfort, KY Micro Area",45939,23180,2010
"Fresno, CA Metro Area",45221,23420,2010
"Gadsden, AL Metro Area",35897,23460,2010
"Gainesville, FL Metro Area",40274,23540,2010
"Gainesville, GA Metro Area",47002,23580,2010
"Galesburg, IL Micro Area",39110,23660,2010
"Gallup, NM Micro Area",29369,23700,2010
"Gettysburg, PA Micro Area",55652,23900,2010
"Glens Falls, NY Metro Area",50936,24020,2010
"Goldsboro, NC Metro Area",40787,24140,2010
"Grand Forks, ND-MN Metro Area",46057,24220,2010
"Grand Island, NE Micro Area",46479,24260,2010
"Grand Junction, CO Metro Area",46231,24300,2010
"Grand Rapids-Wyoming, MI Metro Area",47040,24340,2010
"Grants Pass, OR Micro Area",36626,24420,2010
"Great Falls, MT Metro Area",41871,24500,2010
"Greeley, CO Metro Area",51956,24540,2010
"Green Bay, WI Metro Area",49016,24580,2010
"Greeneville, TN Micro Area",35196,24620,2010
"Greensboro-High Point, NC Metro Area",41120,24660,2010
"Greenville, NC Metro Area",39664,24780,2010
"Greenville-Mauldin-Easley, SC Metro Area",42640,24860,2010
"Greenwood, SC Micro Area",30808,24940,2010
"Guayama, PR Metro Area",18991,25020,2010
"Gulfport-Biloxi, MS Metro Area",41875,25060,2010
"Hagerstown-Martinsburg, MD-WV Metro Area",50529,25180,2010
"Hammond, LA Micro Area",37390,25220,2010
"Hanford-Corcoran, CA Metro Area",44609,25260,2010
"Harrisburg-Carlisle, PA Metro Area",54009,25420,2010
"Harrisonburg, VA Metro Area",45188,25500,2010
"Hartford-West Hartford-East Hartford, CT Metro Area",63104,25540,2010
"Hattiesburg, MS Metro Area",38538,25620,2010
"Helena, MT Micro Area",52114,25740,2010
"Hickory-Lenoir-Morganton, NC Metro Area",39381,25860,2010
"Hilo, HI Micro Area",47100,25900,2010
"Hilton Head Island-Beaufort, SC Micro Area",52496,25940,2010
"Hinesville-Fort Stewart, GA Metro Area",37536,25980,2010
"Holland-Grand Haven, MI Metro Area",53056,26100,2010
"Homosassa Springs, FL Micro Area",35459,26140,2010
"Honolulu, HI Metro Area",68537,26180,2010
"Hot Springs, AR Metro Area",36482,26300,2010
"Houma-Bayou Cane-Thibodaux, LA Metro Area",48185,26380,2010
"Houston-Sugar Land-Baytown, TX Metro Area",53942,26420,2010
"Huntington-Ashland, WV-KY-OH Metro Area",36022,26580,2010
"Huntsville, AL Metro Area",52384,26620,2010
"Huntsville, TX Micro Area",35806,26660,2010
"Hutchinson, KS Micro Area",41946,26740,2010
"Idaho Falls, ID Metro Area",50113,26820,2010
"Indiana, PA Micro Area",41162,26860,2010
"Indianapolis-Carmel, IN Metro Area",48867,26900,2010
"Iowa City, IA Metro Area",48425,26980,2010
"Ithaca, NY Metro Area",52064,27060,2010
"Jackson, MI Metro Area",42862,27100,2010
"Jackson, MS Metro Area",42501,27140,2010
"Jackson, TN Metro Area",40464,27180,2010
"Jacksonville, FL Metro Area",50324,27260,2010
"Jacksonville, NC Metro Area",41787,27340,2010
"Jamestown-Dunkirk-Fredonia, NY Micro Area",40443,27460,2010
"Janesville, WI Metro Area",46758,27500,2010
"Jefferson City, MO Metro Area",51742,27620,2010
"Johnson City, TN Metro Area",36791,27740,2010
"Johnstown, PA Metro Area",41220,27780,2010
"Jonesboro, AR Metro Area",35526,27860,2010
"Joplin, MO Metro Area",38448,27900,2010
"Kahului-Wailuku, HI Micro Area",60617,27980,2010
"Kalamazoo-Portage, MI Metro Area",43634,28020,2010
"Kalispell, MT Micro Area",41854,28060,2010
"Kankakee-Bradley, IL Metro Area",44784,28100,2010
"Kansas City, MO-KS Metro Area",53919,28140,2010
"Kapaa, HI Micro Area",55246,28180,2010
"Keene, NH Micro Area",48030,28300,2010
"Kennewick-Pasco-Richland, WA Metro Area",56407,28420,2010
"Key West, FL Micro Area",50619,28580,2010
"Killeen-Temple-Fort Hood, TX Metro Area",49778,28660,2010
"Kingsport-Bristol-Bristol, TN-VA Metro Area",34741,28700,2010
"Kingston, NY Metro Area",51301,28740,2010
"Klamath Falls, OR Micro Area",37660,28900,2010
"Knoxville, TN Metro Area",43114,28940,2010
"Kokomo, IN Metro Area",41180,29020,2010
"La Crosse, WI-MN Metro Area",47696,29100,2010
"Lafayette, IN Metro Area",40577,29140,2010
"Lafayette, LA Metro Area",46730,29180,2010
"LaGrange, GA Micro Area",41477,29300,2010
"Lake Charles, LA Metro Area",40194,29340,2010
"Lake City, FL Micro Area",32488,29380,2010
"Lake Havasu City-Kingman, AZ Metro Area",36456,29420,2010
"Lakeland-Winter Haven, FL Metro Area",41174,29460,2010
"Lancaster, PA Metro Area",51740,29540,2010
"Lancaster, SC Micro Area",35634,29580,2010
"Lansing-East Lansing, MI Metro Area",47731,29620,2010
"Laredo, TX Metro Area",35770,29700,2010
"Las Cruces, NM Metro Area",35230,29740,2010
"Las Vegas-Paradise, NV Metro Area",51437,29820,2010
"Laurel, MS Micro Area",35438,29860,2010
"Lawrence, KS Metro Area",47263,29940,2010
"Lawton, OK Metro Area",43817,30020,2010
"Lebanon, NH-VT Micro Area",50134,30100,2010
"Lebanon, PA Metro Area",51436,30140,2010
"Lewiston, ID-WA Metro Area",39959,30300,2010
"Lewiston-Auburn, ME Metro Area",41190,30340,2010
"Lexington-Fayette, KY Metro Area",46257,30460,2010
"Lexington Park, MD Micro Area",88444,30500,2010
"Lima, OH Metro Area",41057,30620,2010
"Lincoln, NE Metro Area",50091,30700,2010
"Lincolnton, NC Micro Area",42456,30740,2010
"Little Rock-North Little Rock-Conway, AR Metro Area",45991,30780,2010
"Logan, UT-ID Metro Area",46215,30860,2010
"Longview, TX Metro Area",41842,30980,2010
"Longview, WA Metro Area",41054,31020,2010
"Los Angeles-Long Beach-Santa Ana, CA Metro Area",56691,31100,2010
"Louisville/Jefferson County, KY-IN Metro Area",44678,31140,2010
"Lubbock, TX Metro Area",42126,31180,2010
"Lufkin, TX Micro Area",37775,31260,2010
"Lumberton, NC Micro Area",29453,31300,2010
"Lynchburg, VA Metro Area",41248,31340,2010
"Macon, GA Metro Area",37507,31420,2010
"Madera-Chowchilla, CA Metro Area",48268,31460,2010
"Madison, WI Metro Area",57594,31540,2010
"Manchester-Nashua, NH Metro Area",68312,31700,2010
"Manhattan, KS Metro Area",46150,31740,2010
"Manitowoc, WI Micro Area",47298,31820,2010
"Mankato-North Mankato, MN Metro Area",51127,31860,2010
"Mansfield, OH Metro Area",41572,31900,2010
"Marinette, WI-MI Micro Area",38506,31940,2010
"Marion, IN Micro Area",34716,31980,2010
"Marion, OH Micro Area",38824,32020,2010
"Marion-Herrin, IL Micro Area",43709,32060,2010
"Marquette, MI Micro Area",44684,32100,2010
"Marshall, TX Micro Area",47801,32220,2010
"Marshfield-Wisconsin Rapids, WI Micro Area",43319,32270,2010
"Martinsville, VA Micro Area",31492,32300,2010
"Mayag?ez, PR Metro Area",15864,32420,2010
"McAllen-Edinburg-Mission, TX Metro Area",33732,32580,2010
"Meadville, PA Micro Area",38321,32740,2010
"Medford, OR Metro Area",40177,32780,2010
"Memphis, TN-MS-AR Metro Area",45377,32820,2010
"Merced, CA Metro Area",42449,32900,2010
"Meridian, MS Micro Area",29244,32940,2010
"Miami-Fort Lauderdale-Pompano Beach, FL Metro Area",45352,33100,2010
"Michigan City-La Porte, IN Metro Area",43765,33140,2010
"Midland, MI Micro Area",48706,33220,2010
"Midland, TX Metro Area",53170,33260,2010
"Milwaukee-Waukesha-West Allis, WI Metro Area",49774,33340,2010
"Minneapolis-St. Paul-Bloomington, MN-WI Metro Area",62352,33460,2010
"Minot, ND Micro Area",46768,33500,2010
"Missoula, MT Metro Area",45596,33540,2010
"Mobile, AL Metro Area",39998,33660,2010
"Modesto, CA Metro Area",48044,33700,2010
"Monroe, LA Metro Area",37819,33740,2010
"Monroe, MI Metro Area",50034,33780,2010
"Montgomery, AL Metro Area",45513,33860,2010
"Morehead City, NC Micro Area",40614,33980,2010
"Morgantown, WV Metro Area",43470,34060,2010
"Morristown, TN Metro Area",37065,34100,2010
"Moses Lake, WA Micro Area",42337,34180,2010
"Mount Airy, NC Micro Area",35928,34340,2010
"Mount Pleasant, MI Micro Area",31014,34380,2010
"Mount Vernon-Anacortes, WA Metro Area",55458,34580,2010
"Muncie, IN Metro Area",35902,34620,2010
"Muskegon-Norton Shores, MI Metro Area",38621,34740,2010
"Muskogee, OK Micro Area",39910,34780,2010
"Myrtle Beach-North Myrtle Beach-Conway, SC Metro Area",41568,34820,2010
"Napa, CA Metro Area",64401,34900,2010
"Naples-Marco Island, FL Metro Area",52730,34940,2010
"Nashville-Davidson--Murfreesboro--Franklin, TN Metro Area",47975,34980,2010
"New Bern, NC Micro Area",41059,35100,2010
"New Castle, PA Micro Area",38192,35260,2010
"New Haven-Milford, CT Metro Area",57056,35300,2010
"New Iberia, LA Micro Area",41709,35340,2010
"New Orleans-Metairie-Kenner, LA Metro Area",46134,35380,2010
"New Philadelphia-Dover, OH Micro Area",38882,35420,2010
"New York-Northern New Jersey-Long Island, NY-NJ-PA Metro Area",61927,35620,2010
"Niles-Benton Harbor, MI Metro Area",40329,35660,2010
"North Port-Bradenton-Sarasota, FL Metro Area",45283,35840,2010
"North Wilkesboro, NC Micro Area",31869,35900,2010
"Norwich-New London, CT Metro Area",62349,35980,2010
"Oak Harbor, WA Micro Area",54839,36020,2010
"Ocala, FL Metro Area",37044,36100,2010
"Ocean City, NJ Metro Area",53392,36140,2010
"Odessa, TX Metro Area",42282,36220,2010
"Ogden-Clearfield, UT Metro Area",59171,36260,2010
"Ogdensburg-Massena, NY Micro Area",40163,36300,2010
"Oklahoma City, OK Metro Area",46238,36420,2010
"Olean, NY Micro Area",41578,36460,2010
"Olympia, WA Metro Area",61011,36500,2010
"Omaha-Council Bluffs, NE-IA Metro Area",54060,36540,2010
"Opelousas-Eunice, LA Micro Area",33388,36660,2010
"Orangeburg, SC Micro Area",31979,36700,2010
"Orlando-Kissimmee-Sanford, FL Metro Area",46478,36740,2010
"Oshkosh-Neenah, WI Metro Area",48177,36780,2010
"Ottawa-Streator, IL Micro Area",47898,36860,2010
"Owensboro, KY Metro Area",41021,36980,2010
"Owosso, MI Micro Area",46528,37020,2010
"Oxnard-Thousand Oaks-Ventura, CA Metro Area",71864,37100,2010
"Paducah, KY-IL Micro Area",41137,37140,2010
"Palatka, FL Micro Area",33842,37260,2010
"Palm Bay-Melbourne-Titusville, FL Metro Area",46262,37340,2010
"Palm Coast, FL Metro Area",43993,37380,2010
"Panama City-Lynn Haven-Panama City Beach, FL Metro Area",44881,37460,2010
"Parkersburg-Marietta-Vienna, WV-OH Metro Area",40352,37620,2010
"Pascagoula, MS Metro Area",44878,37700,2010
"Pendleton-Hermiston, OR Micro Area",43784,37820,2010
"Pensacola-Ferry Pass-Brent, FL Metro Area",43974,37860,2010
"Peoria, IL Metro Area",50983,37900,2010
"Philadelphia-Camden-Wilmington, PA-NJ-DE-MD Metro Area",58095,37980,2010
"Phoenix-Mesa-Glendale, AZ Metro Area",50385,38060,2010
"Pine Bluff, AR Metro Area",33446,38220,2010
"Pittsburgh, PA Metro Area",46700,38300,2010
"Pittsfield, MA Metro Area",44190,38340,2010
"Plattsburgh, NY Micro Area",43600,38460,2010
"Pocatello, ID Metro Area",39175,38540,2010
"Ponce, PR Metro Area",16745,38660,2010
"Port Angeles, WA Micro Area",38841,38820,2010
"Portland-South Portland-Biddeford, ME Metro Area",56530,38860,2010
"Portland-Vancouver-Hillsboro, OR-WA Metro Area",53078,38900,2010
"Port St. Lucie, FL Metro Area",41346,38940,2010
"Portsmouth, OH Micro Area",36859,39020,2010
"Pottsville, PA Micro Area",40265,39060,2010
"Poughkeepsie-Newburgh-Middletown, NY Metro Area",67269,39100,2010
"Prescott, AZ Metro Area",40274,39140,2010
"Providence-New Bedford-Fall River, RI-MA Metro Area",51935,39300,2010
"Provo-Orem, UT Metro Area",54201,39340,2010
"Pueblo, CO Metro Area",38326,39380,2010
"Punta Gorda, FL Metro Area",42031,39460,2010
"Quincy, IL-MO Micro Area",39564,39500,2010
"Racine, WI Metro Area",51377,39540,2010
"Raleigh-Cary, NC Metro Area",57840,39580,2010
"Rapid City, SD Metro Area",47074,39660,2010
"Reading, PA Metro Area",51759,39740,2010
"Redding, CA Metro Area",41023,39820,2010
"Reno-Sparks, NV Metro Area",50699,39900,2010
"Richmond, IN Micro Area",36079,39980,2010
"Richmond, VA Metro Area",55325,40060,2010
"Richmond-Berea, KY Micro Area",40866,40080,2010
"Riverside-San Bernardino-Ontario, CA Metro Area",53548,40140,2010
"Roanoke, VA Metro Area",45569,40220,2010
"Roanoke Rapids, NC Micro Area",30888,40260,2010
"Rochester, MN Metro Area",59702,40340,2010
"Rochester, NY Metro Area",50211,40380,2010
"Rockford, IL Metro Area",45457,40420,2010
"Rocky Mount, NC Metro Area",38077,40580,2010
"Rome, GA Metro Area",36934,40660,2010
"Roseburg, OR Micro Area",36510,40700,2010
"Roswell, NM Micro Area",34325,40740,2010
"Russellville, AR Micro Area",38388,40780,2010
"Sacramento--Arden-Arcade--Roseville, CA Metro Area",56233,40900,2010
"Saginaw-Saginaw Township North, MI Metro Area",41938,40980,2010
"St. Cloud, MN Metro Area",50085,41060,2010
"St. George, UT Metro Area",49058,41100,2010
"St. Joseph, MO-KS Metro Area",43178,41140,2010
"St. Louis, MO-IL Metro Area",50912,41180,2010
"Salem, OR Metro Area",45584,41420,2010
"Salinas, CA Metro Area",54534,41500,2010
"Salisbury, MD Metro Area",47128,41540,2010
"Salisbury, NC Micro Area",37360,41580,2010
"Salt Lake City, UT Metro Area",57419,41620,2010
"San Angelo, TX Metro Area",38234,41660,2010
"San Antonio-New Braunfels, TX Metro Area",50225,41700,2010
"San Diego-Carlsbad-San Marcos, CA Metro Area",59923,41740,2010
"Sandusky, OH Metro Area",42246,41780,2010
"San Francisco-Oakland-Fremont, CA Metro Area",73027,41860,2010
"San Germ?n-Cabo Rojo, PR Metro Area",14383,41900,2010
"San Jose-Sunnyvale-Santa Clara, CA Metro Area",83944,41940,2010
"San Juan-Caguas-Guaynabo, PR Metro Area",20897,41980,2010
"San Luis Obispo-Paso Robles, CA Metro Area",53978,42020,2010
"Santa Barbara-Santa Maria-Goleta, CA Metro Area",56767,42060,2010
"Santa Cruz-Watsonville, CA Metro Area",61071,42100,2010
"Santa Fe, NM Metro Area",47080,42140,2010
"Santa Rosa-Petaluma, CA Metro Area",59055,42220,2010
"Savannah, GA Metro Area",46755,42340,2010
"Scranton--Wilkes-Barre, PA Metro Area",42368,42540,2010
"Seaford, DE Micro Area",49006,42580,2010
"Searcy, AR Micro Area",38326,42620,2010
"Seattle-Tacoma-Bellevue, WA Metro Area",63088,42660,2010
"Sebastian-Vero Beach, FL Metro Area",47335,42680,2010
"Sebring, FL Micro Area",34561,42700,2010
"Seneca, SC Micro Area",42848,42860,2010
"Sevierville, TN Micro Area",40402,42940,2010
"Shawnee, OK Micro Area",36795,43060,2010
"Sheboygan, WI Metro Area",49440,43100,2010
"Shelby, NC Micro Area",38282,43140,2010
"Sherman-Denison, TX Metro Area",45577,43300,2010
"Show Low, AZ Micro Area",40623,43320,2010
"Shreveport-Bossier City, LA Metro Area",40762,43340,2010
"Sierra Vista-Douglas, AZ Micro Area",45213,43420,2010
"Sioux City, IA-NE-SD Metro Area",44038,43580,2010
"Sioux Falls, SD Metro Area",52050,43620,2010
"Somerset, PA Micro Area",39978,43740,2010
"South Bend-Mishawaka, IN-MI Metro Area",41991,43780,2010
"Southern Pines-Pinehurst, NC Micro Area",47692,43860,2010
"Spartanburg, SC Metro Area",41850,43900,2010
"Spokane, WA Metro Area",47039,44060,2010
"Springfield, IL Metro Area",50423,44100,2010
"Springfield, MA Metro Area",49209,44140,2010
"Springfield, MO Metro Area",40084,44180,2010
"Springfield, OH Metro Area",39580,44220,2010
"State College, PA Metro Area",44746,44300,2010
"Statesboro, GA Micro Area",29170,44340,2010
"Statesville-Mooresville, NC Micro Area",45714,44380,2010
"Staunton-Waynesboro, VA Micro Area",46292,44420,2010
"Steubenville-Weirton, OH-WV Metro Area",35666,44600,2010
"Stevens Point, WI Micro Area",48620,44620,2010
"Stillwater, OK Micro Area",35488,44660,2010
"Stockton, CA Metro Area",50011,44700,2010
"Sumter, SC Metro Area",36457,44940,2010
"Sunbury, PA Micro Area",35394,44980,2010
"Syracuse, NY Metro Area",49694,45060,2010
"Talladega-Sylacauga, AL Micro Area",34488,45180,2010
"Tallahassee, FL Metro Area",41511,45220,2010
"Tampa-St. Petersburg-Clearwater, FL Metro Area",43547,45300,2010
"Terre Haute, IN Metro Area",41200,45460,2010
"Texarkana, TX-Texarkana, AR Metro Area",40547,45500,2010
"The Villages, FL Micro Area",45026,45540,2010
"Thomasville-Lexington, NC Micro Area",39660,45640,2010
"Toledo, OH Metro Area",41583,45780,2010
"Topeka, KS Metro Area",45360,45820,2010
"Torrington, CT Micro Area",66307,45860,2010
"Traverse City, MI Micro Area",46807,45900,2010
"Trenton-Ewing, NJ Metro Area",70956,45940,2010
"Truckee-Grass Valley, CA Micro Area",54456,46020,2010
"Tucson, AZ Metro Area",44274,46060,2010
"Tullahoma, TN Micro Area",37439,46100,2010
"Tulsa, OK Metro Area",44519,46140,2010
"Tupelo, MS Micro Area",38154,46180,2010
"Tuscaloosa, AL Metro Area",41047,46220,2010
"Twin Falls, ID Micro Area",41505,46300,2010
"Tyler, TX Metro Area",43209,46340,2010
"Ukiah, CA Micro Area",40536,46380,2010
"Utica-Rome, NY Metro Area",46625,46540,2010
"Valdosta, GA Metro Area",36028,46660,2010
"Vallejo-Fairfield, CA Metro Area",63384,46700,2010
"Victoria, TX Metro Area",45802,47020,2010
"Vineland-Millville-Bridgeton, NJ Metro Area",51619,47220,2010
"Virginia Beach-Norfolk-Newport News, VA-NC Metro Area",57315,47260,2010
"Visalia-Porterville, CA Metro Area",43397,47300,2010
"Waco, TX Metro Area",39143,47380,2010
"Warner Robins, GA Metro Area",58401,47580,2010
"Warsaw, IN Micro Area",47308,47700,2010
"Washington-Arlington-Alexandria, DC-VA-MD-WV Metro Area",84523,47900,2010
"Waterloo-Cedar Falls, IA Metro Area",45811,47940,2010
"Watertown-Fort Atkinson, WI Micro Area",49611,48020,2010
"Watertown-Fort Drum, NY Micro Area",43557,48060,2010
"Wausau, WI Metro Area",49356,48140,2010
"Wenatchee-East Wenatchee, WA Metro Area",47839,48300,2010
"Wheeling, WV-OH Metro Area",38415,48540,2010
"Whitewater, WI Micro Area",53388,48580,2010
"Wichita, KS Metro Area",46131,48620,2010
"Wichita Falls, TX Metro Area",39633,48660,2010
"Williamsport, PA Metro Area",41037,48700,2010
"Willimantic, CT Micro Area",60026,48740,2010
"Wilmington, NC Metro Area",44825,48900,2010
"Wilson, NC Micro Area",34883,48980,2010
"Winchester, VA-WV Metro Area",46626,49020,2010
"Winston-Salem, NC Metro Area",42644,49180,2010
"Wooster, OH Micro Area",46288,49300,2010
"Worcester, MA Metro Area",61212,49340,2010
"Yakima, WA Metro Area",40648,49420,2010
"Yauco, PR Metro Area",13721,49500,2010
"York-Hanover, PA Metro Area",56368,49620,2010
"Youngstown-Warren-Boardman, OH-PA Metro Area",39240,49660,2010
"Yuba City, CA Metro Area",46314,49700,2010
"Yuma, AZ Metro Area",42240,49740,2010
"Zanesville, OH Micro Area",40894,49780,2010
